{
  "name": "E2E Test DAO",
  "description": "E2E test service - updated description",
  "website": "https://e2e-test.tokamak.network",
  "admin": "0xf39Fd6e51aad88F6F4ce6aB8827279cffFb92266",
  "created_at": "2026-03-26",
  "updated_at": "2026-03-26",
  "cas": {
    "0x1af6e16fe028811db1b074e962cdb69d13bfea8e5532a0d54a6a45ed1aab2ff2": {
      "name": "Test CA Alpha",
      "description": "E2E test CA certificate Alpha"
    }
  }
}
